{
  "$schema": "ihris-i2ce-module/v1",
  "id": "i2ce/module/tasks-roles",
  "module": "tasks-roles",
  "instance": "i2ce",
  "release": "4.3.3",
  "source": {
    "releaseFile": "src/i2ce/catalogue/nodes/release--i2ce--4.3.3.json",
    "releaseFileMd5": "398b1808ba0f4528a8c204ad7eea090a",
    "path": "i2ce/modules/Pages/modules/TasksAndRoles/TasksAndRoles.xml",
    "sha256": "59f7a5513be295f55e65daa0c164c0133e1ad56ee054ddadd8c60bca26c647f0"
  },
  "parent": "i2ce/module/pages",
  "site": null,
  "displayName": "Tasks and Roles",
  "description": "Provides administator interface to define tasks and role",
  "version": "4.3.0",
  "className": null,
  "category": "Base System Page",
  "creator": "Intrahealth Informatics",
  "link": "https://launchpad.net/i2ce",
  "requirements": [
    {
      "module": "pages",
      "atLeast": "4.3",
      "lessThan": "4.4"
    }
  ],
  "enables": [],
  "conflicts": [],
  "optional": [],
  "forms": [],
  "formClasses": [],
  "pages": [],
  "dataLists": {},
  "locales": [
    "ar",
    "cs",
    "de",
    "en_US",
    "es",
    "fr",
    "gl",
    "it",
    "nl",
    "pt",
    "pt_BR",
    "sw",
    "tl",
    "uk"
  ]
}
