{
  "$schema": "ihris-i2ce-module/v1",
  "id": "ihris-qualify/module/ihris-qualify-CustomReports-search-training",
  "module": "ihris-qualify-CustomReports-search-training",
  "instance": "ihris-qualify",
  "release": "4.3.3",
  "source": {
    "releaseFile": "src/i2ce/catalogue/nodes/release--i2ce--4.3.3.json",
    "releaseFileMd5": "398b1808ba0f4528a8c204ad7eea090a",
    "path": "ihris-qualify/modules/QualifyCustomReports/Reports/SearchTraining/ihris-qualify-CustomReports-search-training.xml",
    "sha256": "c481a376786faf1f8480f5f006a996de0333a6c88153c4c9af85cf2aaa7db7bf"
  },
  "parent": "ihris-qualify/module/ihris-qualify-CustomReports",
  "site": null,
  "displayName": "Search Training Report View",
  "description": "The report view for searching trainings.",
  "version": "4.3.0",
  "className": null,
  "category": null,
  "creator": null,
  "link": null,
  "requirements": [
    {
      "module": "ihris-qualify-CustomReports-training",
      "atLeast": "4.0"
    }
  ],
  "enables": [],
  "conflicts": [],
  "optional": [],
  "forms": [],
  "formClasses": [],
  "pages": [],
  "dataLists": {},
  "locales": [
    "en_US"
  ]
}
