{
  "$schema": "ihris-i2ce-module/v1",
  "id": "i2ce/module/testI2CE@tests-i2ce-packagertest-testi2ce",
  "module": "testI2CE",
  "instance": "i2ce",
  "release": "4.3.3",
  "source": {
    "releaseFile": "src/i2ce/catalogue/nodes/release--i2ce--4.3.3.json",
    "releaseFileMd5": "398b1808ba0f4528a8c204ad7eea090a",
    "path": "i2ce/tests/I2CE_PackagerTest/testI2CE/one.xml",
    "sha256": "5abe2e4d864fc9b2c2f17a4198dd11d90951e42234d714476f1976d63ddbe8d6"
  },
  "parent": null,
  "site": null,
  "displayName": "I2CE Basic System",
  "description": "The I2CE Core System Configuration",
  "version": "3.2.5",
  "className": null,
  "category": "Base System Component",
  "creator": "Intrahealth Informatics",
  "link": "https://launchpad.net/i2ce",
  "requirements": [],
  "enables": [],
  "conflicts": [],
  "optional": [],
  "forms": [],
  "formClasses": [],
  "pages": [],
  "dataLists": {},
  "locales": []
}
