{
  "$schema": "ihris-i2ce-module/v1",
  "id": "i2ce/module/user",
  "module": "user",
  "instance": "i2ce",
  "release": "4.3.3",
  "source": {
    "releaseFile": "src/i2ce/catalogue/nodes/release--i2ce--4.3.3.json",
    "releaseFileMd5": "398b1808ba0f4528a8c204ad7eea090a",
    "path": "i2ce/modules/User/User.xml",
    "sha256": "348d6cd3a7b625fee68f25e67fcde18b0945ecd63460b35dbe60ecbc1c1f040b"
  },
  "parent": null,
  "site": null,
  "displayName": "User",
  "description": "Provides Users",
  "version": "4.3.0",
  "className": "I2CE_Module_User",
  "category": "Base System Component",
  "creator": null,
  "link": "https://launchpad.net/i2ce",
  "requirements": [
    {
      "module": "I2CE",
      "atLeast": "4.3",
      "lessThan": "4.4"
    }
  ],
  "enables": [],
  "conflicts": [],
  "optional": [],
  "forms": [],
  "formClasses": [],
  "pages": [],
  "dataLists": {},
  "locales": []
}
