{
  "$schema": "ihris-i2ce-module/v1",
  "id": "i2ce/module/modulePrompter",
  "module": "modulePrompter",
  "instance": "i2ce",
  "release": "4.3.3",
  "source": {
    "releaseFile": "src/i2ce/catalogue/nodes/release--i2ce--4.3.3.json",
    "releaseFileMd5": "398b1808ba0f4528a8c204ad7eea090a",
    "path": "i2ce/modules/Pages/modules/Admin/modules/ModulePrompter/ModulePrompter.xml",
    "sha256": "1c286af7e8241e50f287d9ef92b4c68217b567985ad8a00a31255fe5bbe13b1f"
  },
  "parent": "i2ce/module/admin",
  "site": null,
  "displayName": "Module Prompter",
  "description": "Module to prompt the enable/disable of specific modules upon login",
  "version": "4.3.0",
  "className": "I2CE_Module_ModulePrompter",
  "category": "Base System Component",
  "creator": "Carl Leitner",
  "link": "https://launchpad.net/i2ce",
  "requirements": [
    {
      "module": "I2CE",
      "atLeast": "4.3",
      "lessThan": "4.4"
    },
    {
      "module": "admin",
      "atLeast": "4.3",
      "lessThan": "4.4"
    }
  ],
  "enables": [],
  "conflicts": [],
  "optional": [],
  "forms": [],
  "formClasses": [],
  "pages": [],
  "dataLists": {},
  "locales": []
}
