{
  "$schema": "ihris-i2ce-module/v1",
  "id": "i2ce/module/one@tests-i2ce-configuratortest-getregisteredfiles",
  "module": "one",
  "instance": "i2ce",
  "release": "4.3.3",
  "source": {
    "releaseFile": "src/i2ce/catalogue/nodes/release--i2ce--4.3.3.json",
    "releaseFileMd5": "398b1808ba0f4528a8c204ad7eea090a",
    "path": "i2ce/tests/I2CE_ConfiguratorTest/GetRegisteredFiles/One.xml",
    "sha256": "238bd1bbb1ed780bf17e4795cfca9eda0fe2ace86c7628b1166401aa311b0783"
  },
  "parent": null,
  "site": null,
  "displayName": "TestOne",
  "description": null,
  "version": "3.2.0",
  "className": null,
  "category": null,
  "creator": null,
  "link": null,
  "requirements": [],
  "enables": [],
  "conflicts": [],
  "optional": [],
  "forms": [],
  "formClasses": [],
  "pages": [],
  "dataLists": {},
  "locales": []
}
