{
  "$schema": "ihris-i2ce-module/v1",
  "id": "ihris-manage/module/SampleData-benefit_type",
  "module": "SampleData-benefit_type",
  "instance": "ihris-manage",
  "release": "4.3.3",
  "source": {
    "releaseFile": "src/i2ce/catalogue/nodes/release--i2ce--4.3.3.json",
    "releaseFileMd5": "398b1808ba0f4528a8c204ad7eea090a",
    "path": "ihris-manage/modules/BaseData/modules/SampleData-benefit_type/SampleData-benefit_type.xml",
    "sha256": "842058b3f1a8a53e975025e18e8f3b1a1c84d893920468b9785f91b81099472d"
  },
  "parent": "ihris-manage/module/ihris-manage-base-data",
  "site": null,
  "displayName": "Benefit Type",
  "description": "Sample Data for form: benefit_type",
  "version": "4.3.0",
  "className": null,
  "category": null,
  "creator": null,
  "link": null,
  "requirements": [
    {
      "module": "ihris-manage-Benefit",
      "atLeast": "4.0"
    }
  ],
  "enables": [],
  "conflicts": [],
  "optional": [],
  "forms": [],
  "formClasses": [],
  "pages": [],
  "dataLists": {
    "benefit_type": 4
  },
  "locales": []
}
