{
  "$schema": "ihris-i2ce-module/v1",
  "id": "ihris-qualify/module/ihris-qualify-CustomReports-training",
  "module": "ihris-qualify-CustomReports-training",
  "instance": "ihris-qualify",
  "release": "4.3.3",
  "source": {
    "releaseFile": "src/i2ce/catalogue/nodes/release--i2ce--4.3.3.json",
    "releaseFileMd5": "398b1808ba0f4528a8c204ad7eea090a",
    "path": "ihris-qualify/modules/QualifyCustomReports/Reports/Training/ihris-qualify-CustomReports-training.xml",
    "sha256": "76e693551d3de2268b8a78938866ba81b711b837f100b1b45b0c0d49e241e5f8"
  },
  "parent": "ihris-qualify/module/ihris-qualify-CustomReports",
  "site": null,
  "displayName": "Qualify Training Reports",
  "description": "Reports based on trainings.",
  "version": "4.3.0",
  "className": null,
  "category": null,
  "creator": null,
  "link": null,
  "requirements": [],
  "enables": [],
  "conflicts": [],
  "optional": [],
  "forms": [],
  "formClasses": [],
  "pages": [],
  "dataLists": {},
  "locales": [
    "en_US"
  ]
}
