{
  "$schema": "ihris-i2ce-module/v1",
  "id": "ihris-manage/module/SampleData-facility",
  "module": "SampleData-facility",
  "instance": "ihris-manage",
  "release": "4.3.3",
  "source": {
    "releaseFile": "src/i2ce/catalogue/nodes/release--i2ce--4.3.3.json",
    "releaseFileMd5": "398b1808ba0f4528a8c204ad7eea090a",
    "path": "ihris-manage/modules/SampleData/modules/SampleData-facility/SampleData-facility.xml",
    "sha256": "1b3a80756c2528bca066980600fb53706a3da78fd867e82ae8177b8d0bd7dce6"
  },
  "parent": "ihris-manage/module/ihris-manage-sample-data",
  "site": null,
  "displayName": "Office/Facility",
  "description": "Sample Data for form: facility",
  "version": "4.3.0",
  "className": null,
  "category": null,
  "creator": null,
  "link": null,
  "requirements": [
    {
      "module": "Facility",
      "atLeast": "4.0"
    }
  ],
  "enables": [],
  "conflicts": [],
  "optional": [],
  "forms": [],
  "formClasses": [],
  "pages": [],
  "dataLists": {
    "facility": 18
  },
  "locales": []
}
